code,name,unit,price,category,page
7718,"MANDIOCA TOLETE CONGELADA E COZIDA CONCEIÇÃO 2,5 KG (CX 4 PCT)",CX,142.14,Hortifruti e Vegetais,43
7716,"MANDIOCA TOLETE CONGELADA E COZIDA MATHEUS 2,5 KG (CX 4 PCT)",CX,169.38,Hortifruti e Vegetais,43
1044,MANJERICÃO DESIDRATADO BRASILSECO 500 G (FDO 10 PCT),PCT,10.61,Temperos,44
8806,MANTEIGA COM SAL DE PRIMEIRA FRIZZO (CX 5 KG),CX,157.81,Laticínios,44
8978,MANTEIGA COM SAL HÉRCULES (CX 5 KG),CX,157.81,Laticínios,44
9152,MANTEIGA COM SAL IPANEMA 500 G (CX 12 UN),UN,24.79,Laticínios,44
4587,MANTEIGA COM SAL ITALAC 500 G (CX 12 UN),UN,26.1,Laticínios,44
9076,MANTEIGA COM SAL PIRACANJUBA 500 G (CX 20 UN),UN,26.06,Laticínios,44
8516,MANTEIGA COM SAL TABLETE TIROLEZ 200 G (CX 12 UN),CX,146.27,Laticínios,44
4483,MANTEIGA COM SAL TRÊS MARIAS (BD 10 KG),BD,378.75,Laticínios,44
5855,MANTEIGA PEQUENA COM SAL TIROLEZ 200 G (CX 12 UN),CX,144.5,Laticínios,44
8318,MANTEIGA PEQUENA EXTRA SEM SAL LA SERENISSIMA 200 G (CX 10 UN),CX,110.38,Laticínios,44
5856,MANTEIGA PEQUENA SEM SAL TIROLEZ 200 G (CX 12 UN),CX,144.5,Laticínios,44
4818,MANTEIGA SACHÊ COM SAL PRESIDENT 10 G (CX 192 UN),CX,123.33,Laticínios,44
473,MANTEIGA SACHÊ COM SAL VIGOR 10 G (CX 192 UN),CX,123.73,Laticínios,44
4819,MANTEIGA SACHÊ SEM SAL PRESIDENT 10 G (CX 192 UN),CX,123.33,Laticínios,44
36,MANTEIGA SACHÊ SEM SAL VIGOR 10 G (CX 192 UN),CX,123.62,Laticínios,44
8401,MANTEIGA SEM SAL BLEND PASSA QUATRO (CX 5 KG),CX,107.31,Laticínios,44
8187,MANTEIGA SEM SAL DE PRIMEIRA FRIZZO (CX 5 KG),CX,157.81,Laticínios,44
4919,MANTEIGA SEM SAL FRIZZO (CX 5 KG),CX,157.81,Laticínios,44
8946,MANTEIGA SEM SAL HÉRCULES (CX 5 KG),CX,157.81,Laticínios,44
8882,MANTEIGA SEM SAL HM (CX 5 KG),CX,151.5,Laticínios,44
9684,MANTEIGA SEM SAL IPANEMA (CX 5 KG),CX,183.76,Laticínios,44
51,MANTEIGA SEM SAL SCALA (CX 5 KG),CX,183.06,Laticínios,44
882,MANTEIGA SEM SAL TIROLEZ (CX 5 KG),CX,175.43,Laticínios,44
130,MANTEIGA SEM SAL TRÊS MARIAS (CX 5 KG),CX,157.81,Laticínios,44
3976,MARGARINA COM SAL 50 % AMÉLIA (BD 14 KG),BD,156.7,Laticínios,44
8583,MARGARINA COM SAL 50% CLAYBOM PERDIGÃO (BD 14 KG),BD,134.73,Laticínios,44
1080,"MARGARINA COM SAL 50% COAMO (BD 14,5 KG)",BD,118.65,Laticínios,44
9132,"MARGARINA COM SAL 70% ELOGIATA (BD 14,5 KG)",BD,158.46,Laticínios,44
245,MARGARINA COM SAL 75% PRIMOR (BD 15 KG),BD,161.54,Laticínios,45
3841,MARGARINA COM SAL 75% SOFITELI (BD 15 KG),BD,164.97,Laticínios,45
6575,MARGARINA COM SAL 80% AMÉLIA (BD 14 KG),BD,203.67,Laticínios,45
4560,"MARGARINA COM SAL 80% COAMO (BD 14,5 KG)",BD,152.14,Laticínios,45
9131,"MARGARINA COM SAL 80% ELOGIATA (BD 14,5 KG)",BD,180.6,Laticínios,45
242,MARGARINA FOLHADOS & CROISSANTS 80% AMÉLIA 2 KG (CX 6 UN),CX,233.61,Laticínios,45
8585,MARGARINA GRANDE COM SAL 50% CLAYBOM PERDIGÃO 1 KG (CX 6 UN),CX,69.41,Laticínios,45
8646,MARGARINA GRANDE COM SAL 80% DORIANA 1 KG (CX 12 UN),CX,150.05,Laticínios,45
8324,MARGARINA GRANDE COM SAL 80% QUALY SADIA 1 KG (CX 6 UN),CX,92.71,Laticínios,45
4312,MARGARINA MÉDIA COM SAL 50% CLAYBOM PERDIGÃO 500 G (CX 12 UN),CX,72.5,Laticínios,45
8648,MARGARINA MÉDIA COM SAL 77% DELÍCIA 500 G (CX 12 UN),CX,81.29,Laticínios,45
3670,MARGARINA MÉDIA COM SAL 80% DORIANA 500 G (CX 12 UN),CX,78.97,Laticínios,45
244,MARGARINA MÉDIA COM SAL 80% QUALY SADIA 500 G (CX 12 UN),CX,101.72,Laticínios,45
8586,MARGARINA PEQUENA COM SAL 50% CLAYBOM PERDIGÃO 250 G (CX 24 UN),CX,79.81,Laticínios,45
9130,MARGARINA PEQUENA COM SAL 60% ELOGIATA 3 KG (CX 6 BD),BD,31.65,Laticínios,45
3408,MARGARINA PEQUENA COM SAL 60% PRIMOR 3 KG (CX 6 BD),BD,31.93,Laticínios,45
5788,MARGARINA PEQUENA COM SAL 75% SOFITELI 3 KG (CX 6 BD),BD,34.58,Laticínios,45
8649,MARGARINA PEQUENA COM SAL 77% DELÍCIA 250 G (CX 24 UN),CX,89.54,Laticínios,45
5201,MARGARINA PEQUENA COM SAL 80% DORIANA 250 G (CX 24 UN),CX,90.03,Laticínios,45
3856,MARGARINA PEQUENA COM SAL 80% QUALY SADIA 250 G (CX 24 UN),CX,118.1,Laticínios,45
1337,MARGARINA SACHÊ COM SAL LECO 10 G (CX 192 UN),CX,72.48,Laticínios,45
5075,"MARGARINA SEM SAL 80% AMÉLIA 1,010 KG (CX 12 UN)",CX,208.16,Laticínios,45
4561,"MARGARINA SEM SAL 80% COAMO (BD 14,5 KG)",BD,157.19,Laticínios,45
8567,MASSA FRESCA NHOQUE DE BATATA FAMIGLIARE 500 G (CX 12 PCT),PCT,8.71,Massas,45
9031,MASSA FRESCA PARA LASANHA BRASILEIRINHA 500 G (CX 12 PCT),PCT,9.26,Massas,45
8565,MASSA FRESCA PARA LASANHA FAMIGLIARE 500 G (CX 22 PCT),PCT,7.25,Massas,45
9692,MASSA FRESCA PARA PASTEL DISCO BRASILEIRINHA 500 G (FDO 12 PCT),PCT,6.47,Massas,45
8566,MASSA FRESCA PARA PASTEL DISCO FAMIGLIARE 500 G (CX 18 PCT),PCT,6.67,Massas,45
7569,MASSA FRESCA PARA PASTEL QUADRADA CORTADA BRASILEIRINHA 50 UN (FDO 4 PCT),PCT,35.71,Massas,46
9477,MASSA FRESCA PARA PASTEL QUADRADA CORTADA REINO DAS MASSAS 2 KG (CX 6 PCT),PCT,21.35,Massas,46
5242,MASSA FRESCA PARA PASTEL ROLO BRASILEIRINHA 1 KG (FDO 4 PCT),FD,38.85,Massas,46
8942,MASSA FRESCA PARA PASTEL ROLO FAMIGLIARE 1 KG (CX 10 UN),UN,14.93,Massas,46
7056,MASSA FRESCA PARA PASTEL ROLO MASSA MÁGICA 1 KG (CX 12 UN),UN,9.54,Massas,46
9476,MASSA FRESCA PARA PASTEL ROLO REINO DAS MASSAS 2 KG (CX 6 PCT),PCT,19.77,Massas,46
8564,MASSA FRESCA TALHARIM FAMIGLIARE 500 G (CX 15 PCT),PCT,8.12,Massas,46
8952,MEIO DAS ASAS DE FRANGO TULIPAS CONGELADAS TEMPERADAS AVELÍCIA (CX 20 KG),CX,311.73,Aves,46
5486,MEL ISIS 1 KG (CX 12 UN),UN,53.03,Açúcares e Adoçantes,46
8550,MEL JP PEREIRA 1 KG (CX 12 UN),UN,47.38,Açúcares e Adoçantes,46
8034,MEL MÉDIO JP PEREIRA 500 G (CX 12 UN),UN,25.31,Açúcares e Adoçantes,46
8289,MEL MÉDIO MINAMEL 900 G (CX 12 BAG),BAG,44.97,Açúcares e Adoçantes,46
8288,MEL MINAMEL 1 KG (CX 12 UN),UN,51.16,Açúcares e Adoçantes,46
4804,MEL PEQUENO ISIS 260 G (CX 12 FR),FR,19.09,Açúcares e Adoçantes,46
5235,MEL SACHÊ ISIS 15 G (CX 144 UN),CX,87.67,Açúcares e Adoçantes,46
8290,MELADO DE CANA MINAMEL 500 G (CX 12 UN),FR,13.0,Açúcares e Adoçantes,46
8968,MELHORADOR DE FARINHA EM PÓ FLEISCHMANN 500 G (CX 30 PCT),PCT,17.14,Farinhas,46
5693,MILHO BONARE GOIÁS VERDE 170 G (CX 24 LT),CX,67.44,Conservas,46
9170,"MILHO CONGELADO ATIGEL 2,5 KG (CX 5 PCT)",PCT,45.59,Congelados,46
3808,MILHO CONGELADO GRANO 2 KG (CX 5 PCT),PCT,38.57,Congelados,46
5692,"MILHO GRANDE BONARE GOIÁS VERDE 1,7 KG (CX 6 LT)",LT,21.77,Conservas,46
8374,"MILHO GRANDE FUGINI 1,7 KG (CX 6 BAG)",BAG,22.39,Bebidas Alcoólicas,46
2937,"MILHO GRANDE PREDILECTA 1,7 KG (CX 6 LT)",LT,23.11,Conservas,46
333,"MILHO GRANDE QUERO 1,7 KG (CX 6 LT)",LT,23.27,Conservas,46
7890,MILHO PARA PIPOCA KISABOR 400 G (FDO 24 PCT),PCT,3.81,Cereais e Grãos,46
4043,MILHO PARA PIPOCA PREMIUM CAMIL 500 G (FDO 12 PCT),PCT,5.16,Cereais e Grãos,46
7304,MILHO PARA PIPOCA PREMIUM YOKI 400 G (FDO 28 PCT),PCT,8.13,Cereais e Grãos,46
2938,MILHO PREDILECTA 170 G (CX 24 LT),CX,66.53,Outros,46
5124,MILHO QUERO 170 G (CX 24 LT),CX,107.43,Conservas,47
8808,MINI SMOKY CHEESE DONUTS PICKERS MCCAIN 1 KG (CX 6 PCT),CX,608.2,Outros,47
9172,"MINI WAFFLES QUADRADOS DE PEDAÇOS DE BATATA CONGELADA PRÉ FRITO FARM FRITES 1,1 KG (CX 10 PCT)",CX,102.0,Hortifruti e Vegetais,47
5034,MIOLO DA ALCATRA BOVINA RESFRIADO JORDANÉSIA 3 KG (CX 25 KG),KG,51.25,Carnes,47
6438,"MISTURA DE LEITE, SORO DE LEITE, CREME DE LEITE E GORDURA VEGETAL MOCOCA 200 G (CX 27 UN)",CX,66.05,Laticínios,47
168,"MISTURA DE REQUEIJÃO SABOR CHEDDAR CORONATA 1,5 KG (CX 10 BIS)",BIS,29.44,Laticínios,47
169,"MISTURA DE REQUEIJÃO SABOR CHEDDAR DALLORA 1,8 KG (CX 8 BIS)",BIS,25.03,Laticínios,47
5276,"MISTURA DE REQUEIJÃO SABOR CHEDDAR PARMATO 1,2 KG (CX 12 BIS)",BIS,22.05,Laticínios,47
166,"MISTURA DE REQUEIJÃO SABOR CHEDDAR PURANATA 1,2 KG (CX 8 BIS)",BIS,12.89,Laticínios,47
4500,"MISTURA DE REQUEIJÃO SABOR CHEDDAR ROSELI 1,2 KG (CX 12 BIS)",BIS,13.4,Laticínios,47
1090,"MISTURA DE REQUEIJÃO SABOR CHEDDAR TOP CHEDDAR 1,2 KG (CX 12 BIS)",BIS,11.8,Laticínios,47
6439,MISTURA LÁCTEA CONDENSADA PEQUENA MOCOCA 395 G (CX 27 UN),CX,120.36,Laticínios,47
3104,MISTURA PARA BOLO BAUNILHA DONA BENTA 450 G (CX 12 PCT),PCT,5.85,Doces e Chocolates,47
3105,MISTURA PARA BOLO CENOURA DONA BENTA 450 G (CX 12 PCT),PCT,5.85,Doces e Chocolates,47
1513,MISTURA PARA BOLO CHOCOLATE DONA BENTA 450 G (CX 12 PCT),PCT,7.52,Doces e Chocolates,47
3170,MISTURA PARA BOLO COCO DONA BENTA 450 G (CX 12 PCT),PCT,5.85,Doces e Chocolates,47
5792,MISTURA PARA BOLO FUBÁ DONA BENTA 450 G (CX 12 PCT),PCT,5.85,Farinhas,47
1514,MISTURA PARA BOLO LARANJA DONA BENTA 450 G (CX 12 PCT),PCT,5.85,Doces e Chocolates,47
3171,MISTURA PARA BOLO MILHO DONA BENTA 450 G (CX 12 PCT),PCT,5.85,Doces e Chocolates,47
9145,MOELA DE FRANGO CONGELADA RICO 1 KG (CX 20 PCT),CX,259.37,Aves,47
3610,"MOLHO ALHO CEPÊRA 1,01 L (CX 12 FR)",FR,12.48,Molhos e Condimentos,47
7684,"MOLHO AMERICANO ZAFRÁN 1,05 KG (CX 5 BAG)",BAG,34.26,Molhos e Condimentos,47
6853,"MOLHO BACONNAISE JUNIOR 1,1 KG (CX 5 BAG)",BAG,48.03,Frios e Embutidos,47
4831,"MOLHO BARBECUE ARRIFANA 3,5 KG (CX 4 GL)",GL,29.16,Molhos e Condimentos,47
7259,"MOLHO BARBECUE CEPÊRA 1,01 KG (CX 12 FR)",FR,14.71,Molhos e Condimentos,47
3729,"MOLHO BARBECUE CEPÊRA 3,5 KG (CX 4 GL)",GL,37.9,Molhos e Condimentos,47
4565,"MOLHO BARBECUE EKMA 3,5 KG (CX 6 GL)",GL,29.21,Molhos e Condimentos,47
6155,MOLHO BARBECUE HEINZ 2 KG (CX 8 BAG),BAG,46.17,Molhos e Condimentos,47
8896,MOLHO BARBECUE SACHÊ CEPÊRA 7 G (CX 154 UN),CX,28.33,Molhos e Condimentos,48
8379,MOLHO BARBECUE SACHÊ FUGINI 7 G (CX 144 UN),CX,17.19,Bebidas Alcoólicas,48
7672,MOLHO BECHAMEL AJINOMOTO 1 KG (CX 6 PCT),PCT,33.77,Açúcares e Adoçantes,48
8959,MOLHO BECHAMEL TECNUTRI 500 G (CX 10 PCT),PCT,21.13,Açúcares e Adoçantes,48
4299,"MOLHO BILLY & JACK ORIGINAL KISABOR 1,01 KG (CX 6 BAG)",CX,105.79,Bebidas Alcoólicas,48
8205,"MOLHO BILLY & JACK TASTY KISABOR 1,01 KG (CX 6 BAG)",CX,105.79,Molhos e Condimentos,48
6585,"MOLHO CHIPOTLE JUNIOR 1,01 KG (CX 5 BAG)",BAG,47.54,Molhos e Condimentos,48
9606,"MOLHO DE PIMENTA SWEET CHILLI HINATA 2,05 L (CX 6 GL)",GL,38.51,Molhos e Condimentos,48
7683,"MOLHO DE PIMENTA THAI SWEET CHILLI ZAFRÁN 1,05 KG (CX 5 BAG)",BAG,31.6,Molhos e Condimentos,48
9631,"MOLHO DE PIMENTA VERMELHA ARRIFANA 1,01 L (CX 12 FR)",FR,8.79,Molhos e Condimentos,48
3611,"MOLHO DE PIMENTA VERMELHA CEPÊRA 1,01 L (CX 12 FR)",FR,10.01,Molhos e Condimentos,48
338,"MOLHO DE PIMENTA VERMELHA EKMA 1,01 L (CX 12 FR)",FR,8.6,Molhos e Condimentos,48
7922,MOLHO DE PIMENTA VERMELHA KISABOR 150 ML (CX 24 UN),CX,71.13,Molhos e Condimentos,48
3249,MOLHO DE PIMENTA VERMELHA MC ILHENNY TABASCO 60 ML (CX 12 VD),CX,289.6,Molhos e Condimentos,48
8897,MOLHO DE PIMENTA VERMELHA SACHÊ CEPÊRA 5 ML (CX 154 UN),CX,23.81,Molhos e Condimentos,48
6910,MOLHO DE PIMENTA VERMELHA SACHÊ EKMA 3 ML (CX 174 UN),CX,16.34,Molhos e Condimentos,48
6069,MOLHO DE PIMENTA VERMELHA SACHÊ PREDILECTA 3 ML (CX 144 UN),CX,14.89,Molhos e Condimentos,48
8833,"MOLHO DE TOMATE HOT DOG EKMA 1,02 KG (CX 12 BAG)",BAG,6.04,Molhos e Condimentos,48
6451,"MOLHO DE TOMATE PIZZA BONARE GOIÁS VERDE 1,7 KG (CX 6 BAG)",CX,63.81,Molhos e Condimentos,48
4876,"MOLHO DE TOMATE PIZZA CEPÊRA MAMMA D ORO 1,7 KG (CX 6 BAG)",CX,104.28,Molhos e Condimentos,48
342,"MOLHO DE TOMATE PIZZA EKMA 1,7 KG (CX 6 BAG)",CX,53.82,Molhos e Condimentos,48
8375,"MOLHO DE TOMATE PIZZA FUGINI 1,7 KG (CX 6 BAG)",CX,61.98,Bebidas Alcoólicas,48
6403,"MOLHO DE TOMATE TRADICIONAL BONARE GOIÁS VERDE 1,7 KG (CX 6 BAG)",CX,63.81,Molhos e Condimentos,48
6275,"MOLHO DE TOMATE TRADICIONAL FUGINI 1,7 KG (CX 6 BAG)",CX,55.62,Bebidas Alcoólicas,48
3860,"MOLHO DE TOMATE TRADICIONAL HEINZ 1,02 KG (CX 12 BAG)",CX,95.22,Molhos e Condimentos,48
3210,"MOLHO DE TOMATE TRADICIONAL MAMMA D ORO CEPÊRA 1,7 KG (CX 6 BAG)",CX,94.8,Molhos e Condimentos,48
7962,"MOLHO DE TOMATE TRADICIONAL POMAROLA 1,7 KG (CX 6 BAG)",CX,80.61,Molhos e Condimentos,48
6448,MOLHO DE TOMATE TRADICIONAL QUERO BAG 2 KG (CX 6 BAG),CX,60.69,Molhos e Condimentos,48
2886,"MOLHO DE TOMATE TRADICIONAL REFOGADO EKMA 1,7 KG (CX 6 BAG)",CX,56.75,Molhos e Condimentos,49
7671,MOLHO DEMI GLACE AJINOMOTO 1 KG (CX 6 PCT),PCT,57.95,Molhos e Condimentos,49
3033,MOLHO DEMI GLACE JUNIOR 500 G (CX 20 PCT),PCT,41.24,Molhos e Condimentos,49
9105,"MOLHO DIJONNESE TRUFADO JUNIOR 1,01 KG (CX 5 BAG)",BAG,40.01,Molhos e Condimentos,49
9106,"MOLHO FRENCH JUNIOR 1,01 (CX 5 BAG)",BAG,33.44,Molhos e Condimentos,49
7680,"MOLHO GRILL ZAFRÁN 1,05 KG (CX 5 BAG)",BAG,33.92,Molhos e Condimentos,49
3398,"MOLHO INGLÊS CEPÊRA 1,01 L (CX 12 FR)",FR,7.18,Molhos e Condimentos,49
3032,MOLHO ITALIAN SACHÊ JUNIOR 18 G (CX 180 UN),CX,110.15,Molhos e Condimentos,49
9100,MOLHO ITALIANO SACHÊ LANCHERO 8 ML (CX 200 UN),CX,41.01,Molhos e Condimentos,49
8832,"MOLHO MADEIRA EKMA 1,02 KG (CX 12 BAG)",BAG,6.04,Molhos e Condimentos,49
8801,"MOLHO MOSTARDA E MEL JUNIOR 1,1 KG (CX 5 BAG)",BAG,31.7,Açúcares e Adoçantes,49
7929,"MOLHO SABOR QUEIJO CHEDDAR DEFUMADO POLENGHI 1,01 KG (CX 6 BIS)",BIS,33.13,Laticínios,49
4766,"MOLHO SABOR QUEIJO CHEDDAR POLENGHI 1,5 KG (CX 4 BIS)",BIS,48.18,Laticínios,49
2976,"MOLHO SABOR QUEIJO CHEDDAR SCHREIBER 1,5 KG (CX 6 BIS)",BIS,36.63,Laticínios,49
5656,"MOLHO SABOR QUEIJO CHEDDAR VIGOR 1,5 KG (CX 4 BIS)",BIS,53.44,Laticínios,49
5409,MOLHO SALADA CAESAR CASTELO 236 ML (CX 12 UN),CX,104.97,Molhos e Condimentos,49
8802,"MOLHO SALADA CAESAR JUNIOR 1,1 (CX 5 BAG)",BAG,35.58,Molhos e Condimentos,49
756,MOLHO SALADA CAESAR KISABOR 240 ML (CX 12 UN),CX,69.63,Molhos e Condimentos,49
7593,MOLHO SALADA ITALIAN SACHÊ EKMA 18 G (CX 42 UN),CX,23.66,Molhos e Condimentos,49
5209,MOLHO SALADA ITALIANO CASTELO 236 ML (CX 12 UN),CX,99.26,Molhos e Condimentos,49
4296,MOLHO SALADA ITALIANO KISABOR 240 ML (CX 12 UN),CX,67.18,Molhos e Condimentos,49
5211,MOLHO SALADA LIMÃO CASTELO 236 ML (CX 12 UN),CX,104.97,Molhos e Condimentos,49
4298,MOLHO SALADA LIMÃO KISABOR 240 ML (CX 12 UN),CX,67.18,Molhos e Condimentos,49
8803,"MOLHO SALADA PARMESÃO JUNIOR 1,1 KG (CX 5 BAG)",BAG,32.38,Molhos e Condimentos,49
4297,MOLHO SALADA PARMESÃO KISABOR 240 ML (CX 12 UN),CX,67.18,Molhos e Condimentos,49
5212,MOLHO SALADA ROSÉ CASTELO 236 ML (CX 12 UN),CX,104.97,Molhos e Condimentos,49
4295,MOLHO SALADA ROSE KISABOR 240 ML (CX 12 UN),CX,76.6,Molhos e Condimentos,49
1118,"MOLHO SHOYU CEPÊRA 1,01 L (CX 12 FR)",FR,11.7,Molhos e Condimentos,49
1280,"MOLHO SHOYU EKMA 1,01 L (CX 12 FR)",FR,7.92,Molhos e Condimentos,50
1448,"MOLHO SHOYU GRANDE EKMA 3,1 L (CX 6 GL)",GL,22.49,Molhos e Condimentos,50
6486,"MOLHO SHOYU MÉDIO MITSUWA 3,1 L (CX 4 GL)",GL,34.37,Molhos e Condimentos,50
7748,MOLHO SHOYU PONZAN 5 L (CX 4 GL),GL,24.95,Molhos e Condimentos,50
6487,MOLHO SHOYU PREMIUM MITSUWA 900 ML (CX 12 FR),FR,13.32,Molhos e Condimentos,50
6358,MOLHO SHOYU PREMIUM SACHÊ MITSUWA 8 ML (CX 250 UN),CX,40.31,Molhos e Condimentos,50
6154,MOLHO SHOYU SACHÊ EKMA 8 ML (CX 96 UN),CX,14.37,Molhos e Condimentos,50
7679,MOLHO SHOYU SATIS AJINOMOTO 5 L (GL 5 L),GL,87.68,Molhos e Condimentos,50
6835,MOLHO SHOYU SUAVE MITSUWA 900 ML (CX 12 FR),FR,13.43,Molhos e Condimentos,50
7198,MOLHO TARÊ KARUI 5 L (CX 4 GL),GL,46.71,Molhos e Condimentos,50
6246,MOLHO TARÊ MITSUWA 5 L (CX 3 GL),GL,68.54,Molhos e Condimentos,50
6247,MOLHO TARÊ SACHÊ MITSUWA 8 ML (CX 252 UN),CX,38.75,Molhos e Condimentos,50
6258,"MOLHO TÁRTARO FOOD SERVICE KISABOR 1,01 (CX 6 BAG)",BAG,18.18,Molhos e Condimentos,50
8916,"MORANGO CONGELADO NEWBERRY 1,02 KG (CX 10 PCT)",PCT,16.97,Hortifruti e Vegetais,50
9677,"MORANGO CONGELADO SOPHARA 1,02 KG (CX 10 PCT)",PCT,12.97,Hortifruti e Vegetais,50
9050,MORTADELA COM PISTACHE BOLOGNA CERATTI 6 KG (CX 1 PÇ),KG,66.05,Frios e Embutidos,50
1279,MORTADELA DEFUMADA OURO PERDIGÃO 4 KG (CX 2 PÇ),KG,23.11,Frios e Embutidos,50
4252,MORTADELA DEFUMADA SEARA GOURMET 5 KG (CX 2 PÇ),KG,15.64,Frios e Embutidos,50
8484,"MORTADELA ITALIANA 471 SP SEARA GOURMET 4,8 KG (CX 2 PÇ)",KG,26.55,Frios e Embutidos,50
4699,MORTADELA REZENDE 5 KG (CX 2 PÇ),KG,8.54,Frios e Embutidos,50
5761,MORTADELA TRADICIONAL AURORA 5 KG (CX 2 PÇ),KG,12.03,Frios e Embutidos,50
250,MORTADELA TRADICIONAL BOLOGNA CERATTI 6 KG (CX 1 PÇ),KG,41.82,Frios e Embutidos,50
251,MORTADELA TRADICIONAL MARBA 5 KG (CX 4 PÇ),KG,12.64,Frios e Embutidos,50
587,MOSTARDA AMARELA HEINZ 255 G (CX 16 FR),CX,176.72,Molhos e Condimentos,50
7565,MOSTARDA AMARELA HEMMER 1 KG (CX 12 FR),FR,16.51,Molhos e Condimentos,50
4970,"MOSTARDA AMARELA KISABOR 1,01 KG (CX 12 FR)",FR,7.49,Molhos e Condimentos,50
3100,MOSTARDA COM MEL CEPÊRA 400 G (CX 12 FR),FR,12.3,Açúcares e Adoçantes,50
5146,MOSTARDA DIJON CEPÊRA 190 G (CX 12 FR),FR,9.73,Molhos e Condimentos,50
3206,MOSTARDA ESCURA HEMMER 200 G (CX 25 FR),FR,8.98,Molhos e Condimentos,51
280,"MOSTARDA GRANDE AMARELA CEPÊRA 3,3 KG (CX 4 GL)",GL,26.72,Molhos e Condimentos,51
417,"MOSTARDA GRANDE AMARELA EKMA 3,3 KG (CX 6 GL)",GL,21.0,Molhos e Condimentos,51
5377,MOSTARDA GRANDE AMARELA HEINZ 2 KG (CX 8 BAG),BAG,41.79,Molhos e Condimentos,51
183,"MOSTARDA GRANDE AMARELA HEMMER 3,6 KG (CX 4 GL)",GL,43.23,Molhos e Condimentos,51
8189,MOSTARDA GRANDE AMARELA LANCHERO 3 KG (FD 6 GL),GL,12.84,Molhos e Condimentos,51
8708,"MOSTARDA GRANDE AMARELA PREDILECTA 3,3 KG (CX 4 GL)",GL,25.3,Molhos e Condimentos,51
8898,MOSTARDA SACHÊ CEPÊRA 7 G (CX 154 UN),CX,15.79,Molhos e Condimentos,51
8872,MOSTARDA SACHÊ EKMA 7 G (CX 140 UN),CX,11.91,Molhos e Condimentos,51
8377,MOSTARDA SACHÊ FUGINI 7 G (CX 144 UN),CX,13.51,Bebidas Alcoólicas,51
7735,MOSTARDA SACHÊ HEINZ 5 G (CX 144 UN),CX,19.18,Molhos e Condimentos,51
8974,MOSTARDA SACHÊ HELLMANN´S 7 G (CX 168 UN),CX,22.27,Molhos e Condimentos,51
3326,MOSTARDA SACHÊ HEMMER 7 G (CX 190 UN),CX,22.86,Molhos e Condimentos,51
7238,MOSTARDA SACHÊ LANCHERO 7 G (CX 150 UN),CX,10.58,Molhos e Condimentos,51
8831,MOSTARDA SACHÊ PREDILECTA 5 G (CX 144 UN),CX,12.99,Molhos e Condimentos,51
867,MUÇARELA APOLO 4 KG (CX 6 PÇ),KG,37.17,Laticínios,51
1319,MUÇARELA BARI 4 KG (CX 6 PÇ),KG,38.91,Laticínios,51
3147,MUÇARELA BOLINHA BOCCATELLE CORONATA (PCT 360 G),PCT,21.33,Laticínios,51
7139,MUÇARELA BONÍSSIMO 4 KG (CX 6 PÇ),KG,37.17,Laticínios,51
8342,MUÇARELA CAMILLA 4 KG (CX 6 PÇ),KG,34.85,Laticínios,51
101,MUÇARELA CLÁSSICA 4 KG (CX 6 PÇ),KG,38.91,Laticínios,51
8556,MUÇARELA COBERTURA MOZZANA PIZZA 2 KG (CX 9 PÇ),PÇ,42.9,Laticínios,51
4785,MUÇARELA COBERTURA PARA PIZZA MOZZALET 2 KG (CX 9 PÇ),PÇ,48.25,Laticínios,51
92,MUÇARELA COOPERNOVA 4 KG (CX 6 PÇ),KG,37.75,Laticínios,51
7951,MUÇARELA DE BÚFALA BOCCONCINO YEMA 330 G (CX 10 PCT),PCT,23.04,Laticínios,51
5585,MUÇARELA DE BÚFALA BOLA LEVITARE 400 G (CX 10 PCT),PCT,27.57,Laticínios,51
4231,MUÇARELA DE BÚFALA CEREJINHA LEVITARE 400 G (CX 10 PCT),PCT,27.57,Laticínios,51
7950,MUÇARELA DE BÚFALA CEREJINHA YEMA 330 G (CX 10 PCT),PCT,23.04,Laticínios,51
3825,MUÇARELA DE BÚFALA LEVITARE 4 KG (CX 6 PÇ),KG,56.68,Laticínios,52
8659,MUÇARELA DE BÚFALA QUALIMUUM 4 KG (CX 6 PÇ),KG,42.93,Laticínios,52
10,"MUÇARELA DE BÚFALA YEMA 3,7 KG (CX 6 PÇ)",KG,49.24,Laticínios,52
3372,MUÇARELA DE VACA E BÚFALA BOCCONCINO YEMA (PCT 330 G),PCT,18.93,Laticínios,52
3342,MUÇARELA DE VACA E BÚFALA CEREJAS YEMA (PCT 330 G),PCT,18.93,Laticínios,52
117,MUÇARELA DE VACA E BÚFALA MARGHERITA YEMA (PÇ 700 G),KG,51.76,Laticínios,52
4319,"MUÇARELA DOMILAC 3 KG (CX ""8"" PÇ)",KG,37.17,Laticínios,52
7507,MUÇARELA FATIADA 16 FATIAS SCAR 400 G (CX 29 PCT),PCT,21.11,Laticínios,52
5299,MUÇARELA FATIADA FRIZZO 2 KG (CX 10 PCT),PCT,85.81,Laticínios,52
8399,MUÇARELA FATIADA GRANDE TIROLEZ 1 KG (CX 6 PCT),PCT,49.91,Laticínios,52
6287,MUÇARELA FATIADA HM 4 KG (CX 6 PCT),PCT,166.85,Laticínios,52
9676,MUÇARELA FATIADA IPANEMA 1 KG (CX 9 PCT),PCT,48.74,Laticínios,52
8523,MUÇARELA FATIADA PEQUENA TIROLEZ 150 G (CX 28 PCT),PCT,8.32,Laticínios,52
5498,"MUÇARELA FATIADA PROCESSADA POLENGHI 2,73 KG (CX 4 PCT)",PCT,104.28,Laticínios,52
5992,"MUÇARELA FATIADA PROCESSADA SCHREIBER 2,27 KG (CX 8 PCT)",PCT,84.91,Laticínios,52
103,MUÇARELA FLEURY 4 KG (CX 6 PÇ),KG,41.81,Laticínios,52
1004,MUÇARELA FRIZZO 4 KG (CX 6 PÇ),KG,39.49,Laticínios,52
4372,MUÇARELA HM 4 KG (CX 6 PÇ),KG,36.01,Laticínios,52
112,MUÇARELA IMPERADOR 4 KG (CX 6 PÇ),KG,36.58,Laticínios,52
1153,MUÇARELA ITALAC 4 KG (CX 6 PÇ),KG,39.9,Laticínios,52
105,MUÇARELA JÓIA 4 KG (CX 6 PÇ),KG,38.33,Laticínios,52
8880,MUÇARELA JUQUEÍ 4 KG (CX 6 PÇ),KG,32.52,Laticínios,52
5909,MUÇARELA LIRA 4 KG (CX 6 PÇ),KG,37.17,Laticínios,52
655,MUÇARELA LITORAL 4 KG (CX 6 PÇ),KG,34.85,Laticínios,52
2934,MUÇARELA MONTE CASTELO 4 KG (CX 6 PÇ),KG,40.65,Laticínios,52
1021,MUÇARELA PILOTO 4 KG (CX 6 PÇ),KG,36.58,Laticínios,52
6541,"MUÇARELA POLENGHI 3,5 KG (CX ""4"" PÇ)",KG,41.81,Laticínios,52
8910,MUÇARELA PROCESSADA SABOR DE MINAS 4 KG (CX 4 PÇ),KG,33.61,Laticínios,52
542,MUÇARELA QUATIGUÁ 4 KG (CX 6 PÇ),KG,39.49,Laticínios,53
4003,MUÇARELA SABOR 4 KG (CX 6 PÇ),KG,32.46,Laticínios,53
113,MUÇARELA SCALA 4 KG (CX 6 PÇ),KG,46.33,Laticínios,53
846,MUÇARELA TIROLEZ 4 KG (CX 6 PÇ),KG,38.33,Laticínios,53
8584,MUÇARELA TRADIÇÃO 4 KG (CX 6 PÇ),KG,42.0,Laticínios,53
97,"MUÇARELA TRÊS MARIAS ""MATO GROSSO"" 4 KG (CX 6 PÇ)",KG,38.62,Laticínios,53
106,"MUÇARELA TRÊS MARIAS ""MINAS GERAIS"" 4 KG (CX 6 PÇ)",KG,38.33,Laticínios,53
1085,"MUÇARELA TRÊS MARIAS RONDÔNIA ""JARU"" 4 KG (CX 6 PÇ)",KG,39.49,Laticínios,53
110,"MUÇARELA TRÊS MARIAS RONDÔNIA ""OURO PRETO"" 4 KG (CX 6 PÇ)",KG,38.91,Laticínios,53
4320,MUÇARELA ZERO LACTOSE TRÊS MARIAS 4 KG (CX 6 PÇ),KG,43.56,Laticínios,53
829,MULTIUSO CLÁSSICO YPÊ 500 ML (CX 12 FR),CX,69.07,Outros,53
7322,MÚSCULO DO TRASEIRO BOVINO RESFRIADO SEM OSSO BOI BRASIL 4 KG (CX 24 KG),KG,31.53,Carnes,53
7383,MÚSCULO DO TRASEIRO BOVINO RESFRIADO SEM OSSO JORDANÉSIA 2 KG (CX 22 KG),KG,34.08,Carnes,53
7385,"NATA GRANDE FRIMESA 3,5 KG (CX 4 BD)",BD,158.53,Outros,53
7064,NATA PEQUENA FRIMESA 300 G (CX 12 PT),PT,15.35,Outros,53
9060,NHOQUE DE BATATA DON RAVELLO 500 G (CX 8 PCT),PCT,9.54,Massas,53
7242,NOZ MOSCADA BOLA BRASILSECO 250 G (FDO 20 PCT),PCT,47.45,Outros,53
7241,NOZ MOSCADA EM PÓ BRASILSECO 250 G (FDO 20 PCT),PCT,25.45,Outros,53
8279,NOZES MARIPOSA LERYC 1 KG (CX 15 PCT),PCT,70.26,Outros,53
1013,NOZES MARIPOSA SEM CASCA BRASILSECO 1 KG (FDO 10 PCT),PCT,73.23,Outros,53
5675,"ÓLEO DE ALGODÃO ELOGIATA FLOR DE ALGODÃO (BD 15,8 L)",BD,179.52,Outros,53
8986,ÓLEO DE ALGODÃO ELOGIATA FLOR DE ALGODÃO 900 ML (CX 20 FR),FR,9.13,Outros,53
4450,"ÓLEO DE ALGODÃO FRY SINA (BD 15,7 L)",BD,167.03,Outros,53
4265,"ÓLEO DE ALGODÃO LIZA (BD 15,8 L)",BD,195.41,Outros,53
6103,ÓLEO DE ALGODÃO LIZA 900 ML (CX 20 FR),FR,14.78,Outros,53
7558,"ÓLEO DE ALGODÃO PEQUENO ELOGIATA 5,1 L (CX 4 GL)",GL,53.17,Outros,53
9117,ÓLEO DE ALGODÃO PEQUENO TRAVIÚ 6 L (CX 3 GL),GL,64.89,Outros,53
4376,"ÓLEO DE ALGODÃO SOYA (BD 15,8 L)",BD,179.52,Outros,53
9116,"ÓLEO DE ALGODÃO TRAVIÚ (BD 15,7 L)",BD,167.54,Outros,54
6354,ÓLEO DE CANOLA LIZA 900 ML (CX 20 FR),FR,16.2,Outros,54
9605,ÓLEO DE GERGELIM TORRADO HINATA 1 L (CX 12 UN),FR,36.23,Cereais e Grãos,54
9627,ÓLEO DE GERGELIM TORRADO KAMAL 900 ML (CX 12 UN),FR,36.11,Cereais e Grãos,54
239,ÓLEO DE GIRASSOL LIZA 900 ML (CX 20 FR),FR,15.81,Outros,54
235,ÓLEO DE MILHO LIZA 900 ML (CX 20 FR),FR,15.75,Outros,54
499,ÓLEO DE SOJA COAMO 900 ML (CX 20 FR),CX,148.18,Outros,54
1082,ÓLEO DE SOJA COCAMAR (LT 18 L),LT,163.87,Outros,54
8706,"ÓLEO DE SOJA FRY MAX SOYA (BD 15,8 L)",BD,171.97,Outros,54
911,ÓLEO DE SOJA LIZA 900 ML (PCT 6 FR),PCT,47.91,Outros,54
925,ÓLEO DE SOJA SOYA 900 ML (CX 20 FR),CX,169.48,Outros,54
9118,ÓLEO DE SOJA TRAVIÚ 6 L (CX 3 GL),GL,52.44,Outros,54
8138,ÓLEO DE SOJA VILA VELHA (CX 18 L),CX,164.82,Outros,54
1840,ÓLEO DE SOJA VILA VELHA (GL 18 L),GL,158.19,Outros,54
6958,"ÓLEO VEGETAL PARA FRITURA FRY SEBELLA SINA (BD 15,8 L)",BD,148.98,Outros,54
9120,"ÓLEO VEGETAL PARA FRITURA PRIME FRY TRAVIÚ (BD 15,8 L)",BD,155.06,Outros,54
7298,ORÉGANO NACIONAL DA TERRINHA 200 G (CX 12 PCT),PCT,11.71,Outros,54
7258,ORÉGANO NACIONAL FLOCOS PENINA 200 G (FD 40 PCT),PCT,10.72,Outros,54
4378,ORÉGANO PEQUENO PERUANO ARCO BELLO 500 G (FDO 20 PCT),PCT,13.43,Outros,54
4377,"ORÉGANO PERUANO ARCO BELLO 1,01 KG (FDO 10 PCT)",PCT,26.44,Outros,54
3318,ORÉGANO PERUANO DI SALERNO 1 KG (FDO 10 PCT),PCT,39.59,Outros,54
8383,ORELHA SUÍNA SALGADA COM MÁSCARA REFFINATO 5 KG (CX 2 PCT),PCT,62.97,Suínos,54
5485,OVO INTEGRAL PASTEURIZADO RESFRIADO FLEISCHEGGS 1 KG (CX 12 UN),UN,35.31,Outros,54
7897,OVO INTEGRAL PASTEURIZADO RESFRIADO MAXXIOVOS 1 KG (CX 12 UN),UN,18.38,Outros,54
8439,OVO INTEGRAL PASTEURIZADO RESFRIADO NATUROVOS 1 KG (CX 12 UN),UN,26.07,Outros,54
1087,OVOS BRANCOS TIPO GRANDE MODELO 60 UN (CX 2 BDJ),CX,43.6,Outros,54
4740,OVOS DE CODORNA GRANJA SÃO PAULO 1 KG (CX 20 PCT),PCT,30.2,Outros,54
8391,OVOS DE CODORNA LOUREIRO 900 G (CX 15 PCT),PCT,32.75,Outros,54
431,PÁ DE ESFIHA (UN 90 X 22 CM),UN,169.98,Outros,55
432,PÁ DE FERRO (UN 35 CM),UN,120.9,Outros,55
433,PÁ DE FERRO (UN 38 CM),UN,146.8,Outros,55
435,PÁ DE MADEIRA (UN 35 CM),UN,202.17,Outros,55
436,PÁ DE MADEIRA (UN 40 CM),UN,212.48,Outros,55
8698,PAÇOQUINHA DE AMENDOIM PAÇOQUITA ROLHA EMBALADA SANTA HELENA 15 G (CX 100 UN),CX,39.43,Cereais e Grãos,55
6781,PAÇOQUINHA DE AMENDOIM QUADRADA DADINHO 20 G (CX 40 UN),CX,23.44,Cereais e Grãos,55
1275,"PAIO SUÍNO SEARA 2,5 KG (CX 6 PCT)",PCT,57.33,Suínos,55
4999,PALETA BOVINA RESFRIADA SEM OSSO E SEM MÚSCULO JORDANÉSIA 9 KG (CX 28 KG),KG,38.73,Carnes,55
5185,PALETA BOVINA RESFRIADA SEM OSSO E SEM MÚSCULO PLENA 13 KG (CX 25 KG),KG,36.82,Carnes,55
9165,PALETA SUÍNA SEM OSSO SEM PELE CONGELADA MY PORK 9 KG (CX 19 KG),KG,17.31,Suínos,55
6152,PALITO SACHÊ BOM SABOR (CX 2000 UN),CX,33.79,Outros,55
